{
  "$schema": "https://json-schema.org/draft/2020-12/schema",
  "title": "Record",
  "type": "object",
  "additionalProperties": false,
  "required": [
    "object_type",
    "schema_version",
    "record_id",
    "record_type",
    "source_record_id",
    "attributes",
    "status",
    "created_at",
    "updated_at"
  ],
  "properties": {
    "object_type": { "type": "string", "enum": ["record"] },
    "schema_version": { "type": "string", "enum": ["1.0.0"] },
    "record_id": {
      "type": "string",
      "pattern": "^[0-9A-Z]{26}$|^[0-9a-fA-F-]{36}$"
    },
    "record_type": { "type": "string", "minLength": 1 },
    "source_record_id": { "type": "string", "minLength": 1 },
    "attributes": { "type": "object", "additionalProperties": true },
    "status": { "type": "string", "enum": ["active", "archived"] },
    "created_at": { "type": "string", "format": "date-time" },
    "updated_at": { "type": "string", "format": "date-time" },
    "metadata": { "type": "object", "additionalProperties": true }
  }
}
