{
  "object_type": "record",
  "schema_version": "1.0.0",
  "record_id": "01HZXY6F0T1A4A4K8D9F4T7V2R",
  "record_type": "customer",
  "source_record_id": "crm-48392",
  "attributes": {
    "name": "Acme Logistics",
    "tier": "enterprise",
    "region": "NA"
  },
  "status": "active",
  "created_at": "2025-01-15T12:05:00Z",
  "updated_at": "2025-01-15T12:05:00Z",
  "metadata": { "source_system": "salesforce" }
}
